{
  "schema_version": "1.0.0",
  "instance_id": "instance_demo_001",
  "paper_id": "paper_demo_001",
  "file_path": "fixtures/schema/vault-root/paper_demo_001.pdf",
  "sha256": "aaaaaaaaaaaaaaaaaaaaaaaaaaaaaaaaaaaaaaaaaaaaaaaaaaaaaaaaaaaaaaaa",
  "instance_status": "available",
  "discovered_at": "2026-01-01T00:02:00Z"
}
